Title,Price,Room Size,Address,URL,Images,Videos,Author Name,Phone,Description,Category
Cho thuê phòng trọ cao cấp tại 64 Trương Văn Bang - Bình Trưng Tây,3.2 triệu/tháng,18 m2,"64 Đường Trương Văn Bang, Phường Bình Trưng Tây, Quận 2, Hồ Chí Minh",https://phongtro123.com/tinh-thanh/ho-chi-minh/cho-thue-phong-tro-cao-cap-tai-64-truong-van-bang-binh-trung-tay.html,"['https://pt123.cdn.static123.com/images/thumbs/900x600/fit/2024/12/19/2acbbbb05bbde6e3bfac5_1734601059.jpg', 'https://pt123.cdn.static123.com/images/thumbs/900x600/fit/2024/12/19/668bec6a0767ba39e3763_1734601059.jpg', 'https://pt123.cdn.static123.com/images/thumbs/900x600/fit/2024/12/19/62193e71297c9422cd6d2_1734601060.jpg', 'https://pt123.cdn.static123.com/images/thumbs/900x600/fit/2024/12/19/c18d0efd1bf0a6aeffe11_1734601060.jpg', 'https://pt123.cdn.static123.com/images/thumbs/900x600/fit/2024/12/19/d8dcc7022b0f9651cf1e4_1734601061.jpg']",[],Chú Hùng (*),0943773920,"['Cho thuê phòng đẹp, giá rẻ, an ninh tốt tại Bình Trưng Tây, Quận 2', 'Diện tích: 18-30m2.', 'Phòng mới xây, cao cấp như khách sạn, đầy đủ nội thất (giường, tủ), vệ sinh khép kín, có máy lạnh, nước nóng năng lượng mặt trời, nhà để xe.', 'Khu an ninh, yên tĩnh, thoáng mát, cách Quận 1 chỉ 10 phút đi xe máy.', 'Có thang máy', 'Giá: từ 3.2 triệu/tháng - 3.8 triệu/tháng', 'Điạ chỉ: 64 Trương Văn Bang - Bình Trưng Tây - Quận 2 (cạnh cầu Giồng Ông Tố 2)', 'Liên hệ: 0943773920 (A.Hùng).']",Phòng trọ
"Cho thuê phòng trọ mới sửa 7/2023 Đường Lương Thế Vinh, Phường Tân Thới Hòa, Quận Tân Phú (gần Đầm Sen)",1.8 triệu/tháng,20 m2,"48/13 Đường Lương Thế Vinh, Phường Tân Thới Hòa, Quận Tân Phú, Hồ Chí Minh",https://phongtro123.com/phong-tro-moi-xay-48-13-luong-the-vinh-phuong-tan-thoi-hoa-tan-phu-gan-dam-sen-pr603145.html,"['https://pt123.cdn.static123.com/images/thumbs/900x600/fit/2022/07/27/hinh-2707-sau-khi-sua-7_1658890843.jpg', 'https://pt123.cdn.static123.com/images/thumbs/900x600/fit/2022/08/02/2507-2_1659407814.jpg', 'https://pt123.cdn.static123.com/images/thumbs/900x600/fit/2023/10/01/pccc3_1696140508.jpg', 'https://pt123.cdn.static123.com/images/thumbs/900x600/fit/2023/10/01/pccc2_1696140505.jpg', 'https://pt123.cdn.static123.com/images/thumbs/900x600/fit/2022/08/02/hinh-1-2107_1659407820.jpg', 'https://pt123.cdn.static123.com/images/thumbs/900x600/fit/2022/07/27/hinh-2707-sau-khi-sua-1_1658890831.jpg', 'https://pt123.cdn.static123.com/images/thumbs/900x600/fit/2022/07/27/hinh-2707-sau-khi-sua-6_1658890841.jpg', 'https://pt123.cdn.static123.com/images/thumbs/900x600/fit/2022/07/27/hinh-2707-sau-khi-sua-3_1658890834.jpg', 'https://pt123.cdn.static123.com/images/thumbs/900x600/fit/2022/07/20/hinh-1-5_1658279087.jpg', 'https://pt123.cdn.static123.com/images/thumbs/900x600/fit/2022/07/27/hinh-2707-sau-khi-sua-2_1658890830.jpg', 'https://pt123.cdn.static123.com/images/thumbs/900x600/fit/2022/06/26/hinh-1-2_1656206427.jpg', 'https://pt123.cdn.static123.com/images/thumbs/900x600/fit/2022/06/26/hinh-1-3_1656206428.jpg', 'https://pt123.cdn.static123.com/images/thumbs/900x600/fit/2022/07/20/hinh-1-6_1658279088.jpg', 'https://pt123.cdn.static123.com/images/thumbs/900x600/fit/2022/07/27/hinh-2707-sau-khi-sua-4_1658890837.jpg', 'https://pt123.cdn.static123.com/images/thumbs/900x600/fit/2022/07/27/hinh-2707-sau-khi-sua-5_1658890839.jpg', 'https://pt123.cdn.static123.com/images/thumbs/900x600/fit/2022/07/27/hinh-2707-sau-khi-sua-8_1658890845.jpg', 'https://pt123.cdn.static123.com/images/thumbs/900x600/fit/2022/07/27/hinh-2707-sau-khi-sua-9_1658890847.jpg', 'https://pt123.cdn.static123.com/images/thumbs/900x600/fit/2023/10/01/pccc1_1696140505.jpg']",['https://www.youtube.com/embed/6BmLv1A-RSc?enablejsapi=1&rel=0&showinfo=0'],Cường Phạm,0938864405,"['Giá Phòng từ 1800k. Đang còn phòng 1800K đến xem đảm bảo ưng ý, cam kết hình đúng với thực tế.', 'Phòng mới sửa chữa 5/2024, địa chỉ 48/13 Lương Thế Vinh Phường Tân Thế Hòa, Q.Tân Phú, nhà hẽm xe hơi lộ giới 5m, lắp đặt hệ thống phòng cháy chữa cháy 9/2023', 'Diện Tích 12m + 8m ( gác lững )', 'Phòng có tolet riêng, cửa sổ, ban công, có phòng dưới trệt', 'Cho nấu ăn trong phòng, Ở được 2-4 người, bạn bè lại chơi thoãi mái.', 'Miễn phí internet, wifi, truyền hình cáp, Camera 15 cái ( an ninh quan sát không góc chết )', 'Phòng Cháy Chữa Cháy lắp đặt từng phòng, lối đi, nơi để xe, xung quanh nhà đầy đủ', 'Để xe trong sân nhà thoáng mát có người trông coi xe cộ.', 'Vị trí gần Đầm Sen, thuận tiện qua lại Q.6, Q.11, Tân Phú', 'Điện 3,5k/ 1 ký, nước 100k / 1 người, xe 100k/ 1 chiếc .', 'Xe để sân sau nhà có người quản lý và trông coi ( không chung chủ ) giúp bạn có cảm giác an toàn, thoải mái', 'Liên hệ: 0938 864 405 để gặp Cường Phạm (phone/zalo), Để biết thêm thông tin chi tiết và xem nhà trong ngày. Thiện chí đón tiếp khách thuê 24/7.']",Phòng trọ
"PHÒNG ĐẸP - DUPLEX - CĂN GÓC DUY NHẤT CHỈ 3,5 tr",3.5 triệu/tháng,25 m2,"42/50/ Đường Hoàng Hoa Thám, Phường 7, Quận Bình Thạnh, Hồ Chí Minh",https://phongtro123.com/cho-thue-nhanh-phong-duplex-gia-tot-trung-tam-quan-binh-thanh-pr595341.html,"['https://pt123.cdn.static123.com/images/thumbs/900x600/fit/2022/01/20/z3125328458060-d3b2b1769bb067249ba372684b008006_1642674609.jpg', 'https://pt123.cdn.static123.com/images/thumbs/900x600/fit/2022/01/20/z3125333717995-aaf80f3ff85e8d6c46fdebb6936c64f4_1642674613.jpg', 'https://pt123.cdn.static123.com/images/thumbs/900x600/fit/2022/01/21/z3056599764585-bfb312d1c9b81aa915d1a517225e519d_1642757656.jpg', 'https://pt123.cdn.static123.com/images/thumbs/900x600/fit/2023/10/08/vielahome-lau-1_1696734838.jpg']",[],Vũ Tuấn,0908345084,"['Cho thuê Phòng Căn Góc xây kiểu duplex như một căn nhà phố RIÊNG BIỆT - TỰ DO đầy đủ công năng, AN NINH - SẠCH SẼ.', '* Kết cấu : Trệt, Lầu, lửng, mái đúc (như 1 căn nhà phố, có nhà xe cá nhân riêng biệt ko để xe kiểu tập thể) ở được 2-3 người...', '+ Phần trệt gồm phòng để xe cá nhân, phòng để xe cho khách, toilet, giặt ủi, kho mini - có tác dụng tạo môi trường sạch sẽ giúp sinh hoạt độc lập, bảo vệ tài sản an toàn.', '+ Phần lầu 1 với chức năng chính là phòng sinh hoạt chung - phòng khách, có khoang bếp, khoang phơi đồ.', '+ Phần Gác lửng cao, dùng để làm việc, học tập ngủ nghỉ', '+ Phần mái được đúc bê tông có hệ thống thông gió và hệ thống phun nước bao quanh từ trên xuống tạo cơ chế làm mát hỗ trợ an toàn phòng chống cháy nổ hiệu quả.', '* Tổng diện tích sử dụng 25m2', '* Vị trí: Trung tâm Quan Bình Thạnh - Thành phố HCM cách Q.1 15 phút xung quanh tiện ích đầy đủ, đường xá rộng rãi giao thông thuận tiện.', '* Giá thuê nhanh 3,5 triệu/ tháng (Duy nhất 1 căn góc)', "">>> Note : Ưu tiên nhân viên phòng hoặc nữ sinh viên. Giờ xem phòng từ 18h đến 19h các ngày trong tuần. Riêng T7 và CN từ 8h đến 10h30' sáng. Địa chỉ số: 42/50/11 Hoàng Hoa Thám, Phường 7, Quận Bình Thạnh"", '***** Liên hệ: 0908.345.084 - 0932.677.806 C. Duyên / A. Tuấn', '***** ĐỘC ĐÁO - TIỆN LỢI - AN NINH AN TOÀN *****', '***** MÔI TRƯỜNG XANH - CỘNG ĐỒNG NHÂN VĂN****']",Phòng trọ
Chuyên cho thuê phòng Cc Đức Khải- Q7 phòng nhỏtolet chung 1tr-2tr3 phòng master tolet riêng 3tr-4tr,1.7 triệu/tháng,10 m2,"Nguyễn Lương Bằng, Phường Phú Mỹ, Quận 7, Hồ Chí Minh",https://phongtro123.com/phong-thue-rieng-chung-cu-era-town-quan-7-pr609404.html,"['https://pt123.cdn.static123.com/images/thumbs/900x600/fit/2023/01/27/0ee3996d-cebb-4392-89a1-e25c6bb101cc_1674809572.jpg', 'https://pt123.cdn.static123.com/images/thumbs/900x600/fit/2023/09/16/img-3453_1694868994.jpg', 'https://pt123.cdn.static123.com/images/thumbs/900x600/fit/2023/01/27/6a2b74d7-f6f4-4c9e-ba00-e67a9202b36b_1674809644.jpg', 'https://pt123.cdn.static123.com/images/thumbs/900x600/fit/2023/10/12/img-5718_1697075486.jpg', 'https://pt123.cdn.static123.com/images/thumbs/900x600/fit/2023/09/16/img-3191_1694869024.jpg', 'https://pt123.cdn.static123.com/images/thumbs/900x600/fit/2023/01/27/463ec002-d1c1-40f0-baf2-18849e3aee00_1674809645.jpg', 'https://pt123.cdn.static123.com/images/thumbs/900x600/fit/2023/10/24/img-3778_1698132274.jpg', 'https://pt123.cdn.static123.com/images/thumbs/900x600/fit/2023/10/12/img-6196_1697075486.jpg', 'https://pt123.cdn.static123.com/images/thumbs/900x600/fit/2023/10/12/img-2869_1697075487.jpg', 'https://pt123.cdn.static123.com/images/thumbs/900x600/fit/2023/11/14/img-4035_1699942389.jpg', 'https://pt123.cdn.static123.com/images/thumbs/900x600/fit/2024/08/23/img-6711_1724374210.jpg', 'https://pt123.cdn.static123.com/images/thumbs/900x600/fit/2024/12/16/img-8115_1734321173.jpg', 'https://pt123.cdn.static123.com/images/thumbs/900x600/fit/2024/12/16/img-8114_1734321237.jpg', 'https://pt123.cdn.static123.com/images/thumbs/900x600/fit/2024/12/16/img-8118_1734321236.jpg']",[],Lê Tú,0815777735,"['Chuyên cho thuê phòng share chung cư Era Town Đức Khải, 15B Nguyễn Lương Bằng, Quận 7.', 'Tiện ích chung cư chợ, trường học, siêu thị, quán ăn, cafe, gym spa,... Đầy đủ bán kính 100m ngay chung cư.', 'Giá phòng tolet chung diện tích 5 - 12m² phòng mới từ 1tr - 2tr3 có khu bếp, khu phơi và bếp nấu chung (đặc biệt số luợng có hạn phòng có máy lạnh và tủ quần áo mới).', 'Giá phòng từ 3tr - 4tr là phòng master có tolet riêng trống hoặc có nội thất cơ bản diện tích 17 - 30m².', 'Chủ nhà thân thiện, dễ tính, trong quá trình ở bị hư hỏng điện nước đều được sữa chữa miễn phí.', 'Sinh viên mới lên SG vui lòng đọc kỹ bài viết tra cứa địa chỉ vị trí và ib zalo nếu cần thêm thông tin chi phí điện nước và hình ảnh thực tế.', 'Cảm ơn..!']",Phòng trọ
"Chính chủ cho thuê phòng trọ cực kì an ninh tại Hồ Văn Huê, Phường 9, Quận Phú Nhuận",3.3 triệu/tháng,22 m2,"Hồ Văn Huê, Phường 9, Quận Phú Nhuận, Hồ Chí Minh",https://phongtro123.com/chinh-chu-cho-thue-phong-tro-cuc-ki-an-ninh-tai-ho-van-hue-phuong-9-quan-phu-nhuan-pr669812.html,['https://pt123.cdn.static123.com/images/thumbs/900x600/fit/2024/11/16/z6038607735066-6ee3e95af1a672d8b6608f3be9039b01_1731749208.jpg'],['https://www.tiktok.com/player/v1/7449974295729687816?&music_info=0&description=0&rel=0'],Anh Tiến,0983659400,"['Chính chủ cho thuê phòng trọ cực kì an ninh tại Hồ Văn Huê, Phường 9, Quận Phú Nhuận', 'Diện tích: 22m2', 'Khu vực rất an ninh', 'Giá thuê: 3tr3/tháng', 'Điện: 4000đ/km', 'Nước: 100k/người', 'Net: 100k/phòng', 'Còn 7 phòng trống', 'Liên hệ: 0983659400']",Phòng trọ
PHÒNG TRỌ ĐỐI DIỆN KS 5 SAO TÂN SƠN NHẤT MỚI XÂY RẤT ĐẸP - GẦN CV HOÀNG VĂN THỤ. GIÁ 5TR BAN CÔNG,5 triệu/tháng,28 m2,"205/10A-B Đường Hoàng Văn Thụ, Phường 8, Quận Phú Nhuận, Hồ Chí Minh",https://phongtro123.com/tinh-thanh/ho-chi-minh/phong-tro-doi-dien-ks-5-sao-tan-son-nhat-moi-xay-rat-dep.html,"['https://pt123.cdn.static123.com/images/thumbs/900x600/fit/2023/04/04/z4237382852854-ed72464cadbd4c61b8ebe2acb970694e_1680602688.jpg', 'https://pt123.cdn.static123.com/images/thumbs/900x600/fit/2023/04/04/z4237382846029-84e0315a368c7ef490aa2a770edd8615_1680602688.jpg', 'https://pt123.cdn.static123.com/images/thumbs/900x600/fit/2023/04/04/z4237382843978-8512bc8537f757f03964bec36d061966_1680602689.jpg', 'https://pt123.cdn.static123.com/images/thumbs/900x600/fit/2023/04/04/z4237382845459-b2579c3c30203c2d1d28143c5889f8a4_1680602689.jpg', 'https://pt123.cdn.static123.com/images/thumbs/900x600/fit/2023/04/04/z4237382846441-78c1d8df5765992ffd88ea5dce7f9a0b_1680602689.jpg', 'https://pt123.cdn.static123.com/images/thumbs/900x600/fit/2023/04/04/z4237382852328-3d10b5e5248e8b7d6547923b67d205ed_1680602689.jpg', 'https://pt123.cdn.static123.com/images/thumbs/900x600/fit/2023/04/04/z4237382854056-4cdab0e96aafa89fef9852df0a662050_1680602690.jpg', 'https://pt123.cdn.static123.com/images/thumbs/900x600/fit/2023/04/04/z4237382857945-806245b0d5673438633519514c5df591_1680602690.jpg', 'https://pt123.cdn.static123.com/images/thumbs/900x600/fit/2023/04/04/z4237382856490-0ae9bc8605028fc445394a7e867913c9_1680602691.jpg', 'https://pt123.cdn.static123.com/images/thumbs/900x600/fit/2023/04/04/z4237382862299-f95a2623bd68fb45ef0087a341c2d150_1680602691.jpg', 'https://pt123.cdn.static123.com/images/thumbs/900x600/fit/2024/12/12/z6123245420864-a40906685e116861d6ef1619d8dbf0b1_1733993802.jpg', 'https://pt123.cdn.static123.com/images/thumbs/900x600/fit/2024/12/12/z6123245423725-53d4c36dd7358e740a00819f23105082_1733993803.jpg', 'https://pt123.cdn.static123.com/images/thumbs/900x600/fit/2024/12/12/z6123245423845-e462a6214e5ea4675e0c4c9a957a881f_1733993803.jpg', 'https://pt123.cdn.static123.com/images/thumbs/900x600/fit/2024/12/12/z6123245432468-48e787f92533ec4bae157a74bec038ac_1733993803.jpg', 'https://pt123.cdn.static123.com/images/thumbs/900x600/fit/2024/12/12/z6123245466645-e5c4a10951ab630f38f5adf32709ffba_1733993804.jpg']",[],hieuthanh2006 (*),0918180057,"['-\xa0Phòng đẹp nằm ngay trung tâm quận Phú Nhuận (xem hình thật). View trước là đối diện Khách Sạn 3* Tân Sơn Nhất, View sau là đường Nguyễn Văn Trỗi.', '+ Phòng\xa0mới rất đẹp được ốp lát gạch, tất cả các phòng đều có CỬA SỔ, CÓ BAN CÔNG, MÁY LẠNH, Rèm cửa. Rất thoáng mát.', '- Bỏ xe dưới tầng hầm, có bảo vệ trong coi, Sân thượng phơi quần áo có mái che, có 02 bộ ghế đá ngồi thư giản.', '- Trong nhà có Thang máy đi lại, Có Camera an ninh quan sát.', '- Toilet riêng, đặc biệt có BẾP nấu ăn.', '- Internet cáp quang lắp đặt trong phòng rất mạnh. Cáp Tivi.', '- Bảo vệ trong coi 24/24 giúp Bạn có cảm giác an toàn, khóa vân tay giờ giấc tự do.', '- Diện tích: 28m2', '+ Giá: 5 tr/tháng', '(MỜI BẠN ĐẾN XEM, CÓ BẢO VỆ DẪN BẠN XEM)', '+ Địa chỉ: 205/10A Hoàng Văn Thụ, P.8, Phú Nhuận, Tp. Hồ Chí Minh.']",Phòng trọ
"Cho thuê phòng trọ 17 Đường số 61, P.Thạnh Mỹ Lợi, Q.2 giá 5tr5",5.5 triệu/tháng,35 m2,"Đường số 61, Phường Thạnh Mỹ Lợi, Quận 2, Hồ Chí Minh",https://phongtro123.com/tinh-thanh/ho-chi-minh/cho-thue-phong-tro-moi-xay-100-17-duong-so-61-p-thanh-my-loi-q2-gia-tu-4tr5.html,"['https://pt123.cdn.static123.com/images/thumbs/900x600/fit/2019/02/26/z-2363975422236099767-5-bd92c18bd3984415aa26911b83e23a2c_1551149402.jpg', 'https://pt123.cdn.static123.com/images/thumbs/900x600/fit/2019/02/26/photo-2019-02-26-082803_1551149353.jpg', 'https://pt123.cdn.static123.com/images/thumbs/900x600/fit/2019/02/26/photo-2019-02-26-082817_1551149356.jpg', 'https://pt123.cdn.static123.com/images/thumbs/900x600/fit/2019/02/26/photo-2019-02-26-082835_1551149359.jpg', 'https://pt123.cdn.static123.com/images/thumbs/900x600/fit/2019/02/26/photo-2019-02-26-082834_1551149358.jpg', 'https://pt123.cdn.static123.com/images/thumbs/900x600/fit/2019/02/26/photo-2019-02-26-082807_1551149354.jpg', 'https://pt123.cdn.static123.com/images/thumbs/900x600/fit/2019/02/26/photo-2019-02-26-082837_1551149360.jpg', 'https://pt123.cdn.static123.com/images/thumbs/900x600/fit/2019/02/26/photo-2019-02-26-082813_1551149355.jpg', 'https://pt123.cdn.static123.com/images/thumbs/900x600/fit/2019/02/26/photo-2019-02-26-082903_1551149378.jpg', 'https://pt123.cdn.static123.com/images/thumbs/900x600/fit/2019/02/26/photo-2019-02-26-082820_1551149356.jpg', 'https://pt123.cdn.static123.com/images/thumbs/900x600/fit/2019/02/26/photo-2019-02-26-082745_1551149379.jpg', 'https://pt123.cdn.static123.com/images/thumbs/900x600/fit/2019/02/26/photo-2019-02-26-082906_1551149378.jpg', 'https://pt123.cdn.static123.com/images/thumbs/900x600/fit/2019/02/26/photo-2019-02-26-082912_1551149379.jpg', 'https://pt123.cdn.static123.com/images/thumbs/900x600/fit/2019/02/26/photo-2019-02-26-082843_1551149375.jpg', 'https://pt123.cdn.static123.com/images/thumbs/900x600/fit/2019/02/26/photo-2019-02-26-082840_1551149375.jpg']",[],Khánh,0989997054,"['Cho thuê phòng trọ tại P.Thạnh Mỹ Lợi, Q2', '- Giá thuê từ: 5tr5', '- Địa chỉ: Đường số 61, P. Thạch Mỹ Lợi, Q2 (Đối diện mặt sau Chung cư Vista Verde). Các bạn tới xem nhà thì tới chung cư Verde vista gọi mình dẫn vô cho dễ.', '- Có trang bị nội thất cơ bản:', '+ Máy lạnh', '+ Giường ngủ', '+ Tủ quần áo', '+ Kệ bếp', '+ Thang máy', '+ Hầm để xe', '+ Cửa sổ', '+ Ban công thoáng mát', '- Khu vực gần đảo kim cương dân trí cao, yên tĩnh thích hợp với các bạn đi làm văn phòng, cần nơi yên tĩnh để nghỉ ngơi sau giờ làm việc.', '- Phòng chính chủ mới xây 100%.', 'Bạn nào có nhu cầu LH: zalo, facebook, hoặc sdt: 0989997054 (Khánh)']",Phòng trọ
"Cho thuê Phòng Trọ riêng biệt, rộng Thoáng – sau nhà 175 phan Anh",2.2 triệu/tháng,20 m2,"3/26 Đường Liên khu 10-11, Phường Bình Trị Đông, Quận Bình Tân, Hồ Chí Minh",https://phongtro123.com/cho-thue-phong-tro-moi-rieng-biet-rong-thoang-sau-nha-175-phan-anh-pr609989.html,"['https://pt123.cdn.static123.com/images/thumbs/900x600/fit/2022/11/05/z3856577166368-dea106bf8442ee237840c00ec734c621_1667630805.jpg', 'https://pt123.cdn.static123.com/images/thumbs/900x600/fit/2022/11/05/z3856577158643-0d3cdb90d2c7206fb4a354dc9e7e3978_1667630804.jpg', 'https://pt123.cdn.static123.com/images/thumbs/900x600/fit/2022/12/15/z3961637469027-e3ab6185c95c6b290a58d66071f80859_1671090539.jpg', 'https://pt123.cdn.static123.com/images/thumbs/900x600/fit/2022/12/15/z3961637485101-bce2500cfbebf902203e871529190138_1671090539.jpg', 'https://pt123.cdn.static123.com/images/thumbs/900x600/fit/2022/12/15/z3961637489305-981bcded2403b09346fe6f99ae7f7f6f_1671090539.jpg', 'https://pt123.cdn.static123.com/images/thumbs/900x600/fit/2022/12/15/z3961637495765-d671a02098d58e8b43ddcc4cab636b72_1671090540.jpg', 'https://pt123.cdn.static123.com/images/thumbs/900x600/fit/2022/12/15/z3961637491516-f409f9dc6cf5e8cfbeb1397d5bd6e370_1671090539.jpg']",[],Phạm Thị Thanh Tâm,0932921462,"['- Cho thuê nhiều Phòng trọ riêng biệt – sau nhà 175 PHAN ANH, giáp Tân Phú, giáp Đầm Sen Q11 (Ngay ngã 4, Phan Anh – Lý Thánh Tông);', '- DT 3mx4m, 4mx5m, DT 20 - 30m2,', '- Giá từ 2,2 triệu - 2,4 Triệu/tháng,', '- Nhà rộng đẹp thoáng mát, BTCT, có gác lửng trong phòng, 11g30 đóng cửa, WC riêng trong phòng, điện nước lối đi riêng, cáp, net, Camera quan sát ...', 'Đc: Hướng dẫn, Tới số 175 Phan Anh , phía sau nhà 175 - Hẻm đầu tiên bên tay trái: 3/26 Liên khu 10 -11, P.Bình Trị Đông, Q.Bình Tân, ACE có ai thuê giới thiệu dùm', 'LH: 0932921462 C Tâm']",Phòng trọ
"PHÒNG TRỌ CAO CẤP KHU HOÀNG HOA THÁM – TÂN BÌNH, THANG MÁY, BV 24H, CỬA SỔ RA NGOÀI TRỜI THOÁNG MÁT",3.3 triệu/tháng,25 m2,"227 Đường Hoàng Hoa Thám, Phường 13, Quận Tân Bình, Hồ Chí Minh",https://phongtro123.com/tinh-thanh/ho-chi-minh/can-ho-mini-cao-cap-tai-bakista-apartment-moi-100-mat-tien-d-hoa-hoa-tham-thang-may-gio-tu-do-bv-24-24-may-lanh.html,"['https://pt123.cdn.static123.com/images/thumbs/900x600/fit/2024/11/09/z6014487000800-2597ecba93d9202938c89be514a4b540_1731126045.jpg', 'https://pt123.cdn.static123.com/images/thumbs/900x600/fit/2024/11/09/z6014486991875-bddd093862e57fc36b350a2a0c6e7dc6_1731126040.jpg', 'https://pt123.cdn.static123.com/images/thumbs/900x600/fit/2024/11/09/z6014486994240-3b21db6f37c58b0f86cb752b96c871f1_1731126040.jpg', 'https://pt123.cdn.static123.com/images/thumbs/900x600/fit/2024/11/09/z6014486974971-9563914f3e0f1f44848621200aaf7cab_1731126042.jpg', 'https://pt123.cdn.static123.com/images/thumbs/900x600/fit/2024/11/09/z6014487008856-9307e030e3fd83610a0b928b8071a5ae_1731126046.jpg', 'https://pt123.cdn.static123.com/images/thumbs/900x600/fit/2024/11/09/z6014487010361-6d3ee4e312be22f5bc86f83d9e2434a9_1731126047.jpg', 'https://pt123.cdn.static123.com/images/thumbs/900x600/fit/2024/11/09/z6014487020884-03a0b27aad40a161d58fbfb39ba886ac_1731126048.jpg', 'https://pt123.cdn.static123.com/images/thumbs/900x600/fit/2024/11/09/z6014486977231-903a6a430d03fe8c76797cfb919dbaac_1731126048.jpg', 'https://pt123.cdn.static123.com/images/thumbs/900x600/fit/2024/11/09/z6014487027168-2dc305204dd1145396f2813ec262d12b_1731126049.jpg', 'https://pt123.cdn.static123.com/images/thumbs/900x600/fit/2024/11/09/z6014487034247-7361d4ed7d114b1f6790bf4930be9bd2_1731126042.jpg', 'https://pt123.cdn.static123.com/images/thumbs/900x600/fit/2024/11/09/z6014486987110-16f31e75ae2819bfc7f2ed4c5b316f97_1731126044.jpg']",['https://www.tiktok.com/player/v1/7449660366860061960?&music_info=0&description=0&rel=0'],Kim940,0913265940,"['1. Vị trí :', 'Bakista Apartment nằm tại những con đường rộng trong bán kính 300m tính từ cầu vượt Cộng Hòa – Hoàng Hoa Thám (xin xem bản đồ đính kèm) :', 'Cơ sở 1 : 227 Hoàng Hoa Thám, P.13, Q. Tân Bình', 'Cơ sở 2 : 41/10 Mai Lão Bạng, P.13, Q. Tân Bình', 'Cơ sở 3 : 63 Ngô Bệ, P.13, Q. Tân Bình', 'Chỉ với 10 phút đến sân bay, 20 phút đến Quận 1, 3, 5, 10, 11, Bình Thạnh. Rất gần chợ, siêu thị, ngân hàng.', '2. Những điểm chung nổi bật của tòa nhà :', 'Mặt tiền tòa nhà đẹp với phong cách kiến trúc tân cổ điển kiểu Pháp.', 'An toàn cao : Tầng hầm, hành lang, mỗi căn hộ đều được trang bị đầu báo cháy, đầu phun nước tự động và cầu dao điện chống giật. Hai thang thoát hiểm.', 'Thang máy Nhật tốc độ cao, miễn phí.', 'Tầng Hầm để xe rộng rãi ốp đá hoa cương, ra vào tòa nhà 24/24.', 'Camera quan sát tầng hầm, hành lang, thang máy. Wifi', 'Sân thượng để thư giãn rộng rãi, view toàn thành phố rất đẹp.', '3. Điểm đặc biệt trong mỗi phòng :', 'Gác lửng được đúc bằng bê tông chắc chắn – đẹp mắt, nền lát gạch 600x600 và đứng không đụng đầu. Cầu thang lên gác ốp đá hoa cương lên xuống rất dễ dàng.', 'Hai cửa sổ mở ra ngoài trời chuyển nắng và gió vào phòng, có dèm cửa.', 'Cửa gỗ tự nhiên căm xe sang trọng, gương soi lớn trong phòng.', 'Hai tủ gỗ treo áo bố trí âm tường. Tủ dép riêng tại hành lang. Máy lạnh.', 'WC riêng (thiết bị cao cấp Inax của Nhật), nước máy, nước nóng miễn phí.', 'Có kệ bếp, tủ bếp trên – dưới, bồn rửa chén.', 'Gạch nền bóng kính 600x600, tường ốp gạch men 300x600 cao cấp nhập khẩu', 'Sân phơi tại balcone mỗi phòng.', '4. Diện tích và giá thuê :', 'Diện tích 25m2; 28 m2 : giá từ 3,3 triệu/tháng đến 4,0 triệu/tháng', 'Bakista – Tiện ích tối đa, cả nhà đều thích.']",Phòng trọ
