Title,Price,Room Size,Address,URL,Images,Videos,Author Name,Phone,Description,Category
"CHÍNH CHỦ CHO THUÊ CHDV SIÊU RỘNG, GIÁ ƯU ĐÃI DỊP TẾT",7.5 triệu/tháng,40 m2,"Huỳnh Văn Bánh, Phường 13, Quận Phú Nhuận, Hồ Chí Minh",https://phongtro123.com/chinh-chu-cho-thue-chdv-sieu-rong-gia-uu-dai-dip-tet-pr671358.html,"['https://pt123.cdn.static123.com/images/thumbs/900x600/fit/2024/12/16/z6128703071318-8704511ad876d92f84880d4264726d34_1734313176.jpg', 'https://pt123.cdn.static123.com/images/thumbs/900x600/fit/2024/12/16/z6128703071319-1c9c101e9eafaae8f9fba8a7747707e7_1734313178.jpg', 'https://pt123.cdn.static123.com/images/thumbs/900x600/fit/2024/12/16/z6128703071320-4cf9b00d2b943f8e970caa7ff2f2b51f_1734313178.jpg', 'https://pt123.cdn.static123.com/images/thumbs/900x600/fit/2024/12/16/z6128703071323-db53b117b07ec8b75a9880c1ce0849a9_1734313181.jpg', 'https://pt123.cdn.static123.com/images/thumbs/900x600/fit/2024/12/16/z6128703071333-b9c9c0fd7171ee890ed4c85ad1b9c847_1734313181.jpg', 'https://pt123.cdn.static123.com/images/thumbs/900x600/fit/2024/12/16/z6128703071335-572267f58c3903b832bd36a93285c9f5_1734313183.jpg', 'https://pt123.cdn.static123.com/images/thumbs/900x600/fit/2024/12/16/z6128703071343-e1fb3d2a2383c510aa8e1c07eb83e0a3_1734313184.jpg', 'https://pt123.cdn.static123.com/images/thumbs/900x600/fit/2024/12/16/z6128703174837-13fef13ab5b68ab96dbe0639a265ffa9_1734313185.jpg']",[],Trần thanh hải,0933598239,"['cho thuê căn hộ full nội thất nguyên lầu 1 máy giặt riêng không chung chủ.', 'Địa chỉ: 476/26g Huỳnh Văn Bánh, phường 13, quận Phú Nhuận', '- Diện tích: 40m2', '• Full Nội Thất Như Hình', '• PCCC Tốt , Camera An Ninh', '• Giờ Giấc Tự Do , Ko Chung Chủ', '• Điện: 4k , nước 100k , Dịch Vụ 200k', 'vị trí Ngay Nhà thờ Ba Chuông, các trường đại học, cao đẳng và học viện lớn: Học viện hàng không Việt Nam - VAA, Trường cao đẳng FPT Polytechnic, Đại học Tài nguyên và Môi trường TP. HCM, Đại học Kinh tế TP. HCM - UEH cơ sở H, Đại học Gia Định - GDU,...', '*** miễn môi giới, đăng tin']",Căn hộ chung cư
"Căn hộ mini dạng Duplex Full NT cao cấp ngay ngã tư Hàng Xanh, Bình Thạnh",7.5 triệu/tháng,35 m2,"Đường Bạch Đằng, Phường 15, Quận Bình Thạnh, Hồ Chí Minh",https://phongtro123.com/phong-tro-dang-studio-full-nt-cao-cap-ngay-nga-tu-hang-xanh-binh-thanh-3-pr664188.html,"['https://pt123.cdn.static123.com/images/thumbs/900x600/fit/2024/09/11/4007b729-d0a7-4167-a203-8b5476e123f7-1-102-o_1726038394.jpg', 'https://pt123.cdn.static123.com/images/thumbs/900x600/fit/2024/09/11/3f04751e-a88d-40eb-a7fb-4cdd06a80d9e-1-102-o_1726038401.jpg', 'https://pt123.cdn.static123.com/images/thumbs/900x600/fit/2024/09/11/ae2c1490-0ee9-4c85-b5f9-59bf5ce368e0-1-102-o_1726038408.jpg', 'https://pt123.cdn.static123.com/images/thumbs/900x600/fit/2024/09/11/1_1726038438.jpg', 'https://pt123.cdn.static123.com/images/thumbs/900x600/fit/2024/09/11/3_1726038438.jpg', 'https://pt123.cdn.static123.com/images/thumbs/900x600/fit/2024/09/11/80fcbf81-0754-4677-954a-c89fe841e319-1-105-c_1726038460.jpg', 'https://pt123.cdn.static123.com/images/thumbs/900x600/fit/2024/09/11/2a666b37-ac62-4be5-93d4-e2cce6da6b00-1-105-c_1726038571.jpg', 'https://pt123.cdn.static123.com/images/thumbs/900x600/fit/2024/09/11/0f7739a7-da9a-4429-8143-6a4d736ab66e-1-102-o_1726038600.jpg', 'https://pt123.cdn.static123.com/images/thumbs/900x600/fit/2024/09/11/32cfac31-a17c-4f94-89af-d0e9c0f48a20-1-105-c_1726038600.jpg', 'https://pt123.cdn.static123.com/images/thumbs/900x600/fit/2024/09/11/bd0e09bd-c480-406a-88a9-a88de05d6fde-1-102-o_1726038600.jpg']",[],THANH VU,0365459999,"['Duplex mới, thiết kế hiện đại, trang bị FULL nội thất cao cấp : Cửa khoá từ, Tủ bếp trên dưới, Tủ lạnh, Máy lạnh, Máy hút mùi, Tủ áo, Bàn ghế, Chăn, Ga, Gối Nệm... Giá thuê từ 7,5 triệu.', 'Các tiện ích đi kèm : Thang máy Mitsubishi, Hệ thống PCCC hiện đại, Máy nước nóng NLMT, Máy lạnh inverter, Khu vực Giặt Sấy chuẩn 5 sao view Landmark 81, Hầm xe rộng rãi, Hệ thống camera an ninh 24/24, Internet tốc độ cao, Cửa ra vô 2 lớp bảo mật', 'Địa chỉ : 71 Bạch Đằng, Phường 15 Quận Bình Thạnh. Khu phố trung tâm, sầm uất ngay ngã tư Hàng Xanh. Chỉ 5 phút tới các trường ĐH : Hutech, ĐH Quốc Tế Hồng Bàng, ĐH Kinh Tế UEF, RMIT…5 phút qua Landmark 81, Quận 1, Q. Phú Nhuận.', 'Phù hợp với người đi làm, gia đình nhỏ, các bạn sinh viên, những ai đang tìm kiếm 1 không gian sống tiện nghi, văn minh, lịch sự.', '️ Liên hệ chính chủ: 036 545 9999. Không tiếp quảng cáo, Miễn TG, anh chị em môi giới vui lòng không gọi. Xin cảm ơn !']",Căn hộ chung cư
"Giảm 500K/tháng đầu. Phòng mới đẹp, rộng thoáng mát, nội thất mới, miễn phí để xe.",3.5 triệu/tháng,40 m2,"417/69 Lê Văn Thọ, Phường 9, Quận Gò Vấp, Hồ Chí Minh",https://phongtro123.com/giam-500k-thang-dau-phong-moi-dep-rong-thoang-mat-noi-that-moi-mien-phi-de-xe-pr671968.html,"['https://pt123.cdn.static123.com/images/thumbs/900x600/fit/2024/12/13/4_1734061951.png', 'https://pt123.cdn.static123.com/images/thumbs/900x600/fit/2024/12/13/1_1734061973.png', 'https://pt123.cdn.static123.com/images/thumbs/900x600/fit/2024/12/13/3_1734061976.png', 'https://pt123.cdn.static123.com/images/thumbs/900x600/fit/2024/12/13/2_1734061976.png', 'https://pt123.cdn.static123.com/images/thumbs/900x600/fit/2024/12/13/5_1734061979.png']",[],Nhung Lê,0868999519,"['- Nhà mới, hẻm rộng, khu ở an ninh, gần chợ, siêu thị, gần công viên Làng Hoa, ĐH Công Nghiệp.', '- Chỗ để xe: Miễn phí, rộng rãi, sạch sẽ.', '- Nội thất: tủ quần áo, máy lạnh, tủ lạnh, bếp từ, kệ bếp, quạt, máy giặt, máy sấy.', '- Không chung chủ, giờ giấc tự do, ra vào cửa vân tay, camera an ninh', '- Nước máy 100K/người, điện 3.700k/kw.']",Căn hộ chung cư
"Cho thuê căn hộ dịch vụ ở Quận 9, Ưu đãi 500k khi ký hợp đồng vào ở liền",6.5 triệu/tháng,27 m2,"73 Trương Văn Thành, Phường Hiệp Phú, Quận 9, Hồ Chí Minh",https://phongtro123.com/cho-thue-can-ho-dich-vu-o-quan-9-uu-dai-500k-khi-ky-hop-dong-vao-o-lien-pr671314.html,"['https://pt123.cdn.static123.com/images/thumbs/900x600/fit/2024/12/05/img-1731999640352-1732073933570_1733369946.jpg', 'https://pt123.cdn.static123.com/images/thumbs/900x600/fit/2024/12/05/img-1731999636437-1732073930488_1733370082.jpg', 'https://pt123.cdn.static123.com/images/thumbs/900x600/fit/2024/12/05/img-1731999637408-1732073931054_1733370082.jpg', 'https://pt123.cdn.static123.com/images/thumbs/900x600/fit/2024/12/05/img-1731999638039-1732073931807_1733370084.jpg', 'https://pt123.cdn.static123.com/images/thumbs/900x600/fit/2024/12/05/img-1731999638744-1732073932536_1733370084.jpg', 'https://pt123.cdn.static123.com/images/thumbs/900x600/fit/2024/12/05/img-1731999639495-1732073933085_1733370086.jpg']",[],Bùi Linh Giang,0962337860,"['Cho thuê căn hộ dịch vụ', 'Vị trí gần trường UFM, Hutech, FPT, khu CNC, thuận tiện di chuyển Lê Văn Việt, VinHome Q9, xa lộ Hà Nội...', 'Phòng rộng, thoáng mát, ánh sáng tự nhiên', 'Nội thất đầy đủ: Giường Nệm, bàn ghế, tủ quần áo, tủ lạnh, rèm cửa, 2 máy lạnh, bình nóng lạnh, bếp + tủ bếp, máy giặt (sử dụng chung).', 'Wifi miễn phí', 'Camera an ninh, thang máy, thẻ từ ra vào, giờ giấc tự do, không chung chủ', 'Dọn vệ sinh 1 tuần/lần', 'Hầm để xe rộng', 'Giá thuê từ 6tr5 đến 7tr5/tháng', '73 Trương Văn Thành, KP3, Phường Hiệp Phú, Thủ Đức, HCM', 'Liên hệ ngay Mrs Giang: 0962337860 để được tư vấn và đến xem trực tiếp.']",Căn hộ chung cư
Cần SANG lại CHDV Đang Cho Thuê Ngay Trung Tâm Quận Phú Nhuận Giá Cực Rẻ,18 triệu/tháng,55 m2,"Đường Trần Kế Xương, Phường 7, Quận Phú Nhuận, Hồ Chí Minh",https://phongtro123.com/can-sang-nhuong-chvd-dang-cho-thue-ngay-trung-tam-quan-phu-nhuan-gia-cuc-re-pr670728.html,"['https://pt123.cdn.static123.com/images/thumbs/900x600/fit/2024/11/27/z5550465144083-d23141adf69056a5436fba9794dc8afd_1732704201.jpg', 'https://pt123.cdn.static123.com/images/thumbs/900x600/fit/2024/11/27/z5550465155192-cab08cb09d880a0bc82c477214c696db_1732704201.jpg', 'https://pt123.cdn.static123.com/images/thumbs/900x600/fit/2024/11/27/z5550465066969-1999878df1aac474ea8987fb6b3e1df5_1732704203.jpg', 'https://pt123.cdn.static123.com/images/thumbs/900x600/fit/2024/11/27/z5550465130998-f0772b4eb131f4bbd84fd322750a62a5_1732704204.jpg', 'https://pt123.cdn.static123.com/images/thumbs/900x600/fit/2024/11/27/z5550465117411-033ce84b9a9aacfc25960088a8c94a71_1732704210.jpg', 'https://pt123.cdn.static123.com/images/thumbs/900x600/fit/2024/11/27/z5550465170438-4c8efb2c05c3ebd9b8bd1cf099f8c9c7_1732704212.jpg', 'https://pt123.cdn.static123.com/images/thumbs/900x600/fit/2024/11/27/z5550465105311-96a95df7cbdba5b4a59b4b7bc3391237_1732704222.jpg', 'https://pt123.cdn.static123.com/images/thumbs/900x600/fit/2024/11/27/z5550464934295-f15e538faaecb825ef1e5b1e9a72e905_1732704222.jpg', 'https://pt123.cdn.static123.com/images/thumbs/900x600/fit/2024/11/27/z5550464972993-7d9149f09518a9f001a0597da044da5d_1732704225.jpg', 'https://pt123.cdn.static123.com/images/thumbs/900x600/fit/2024/11/27/z5550465049481-61f2f941d1c0e70f0779c31799d5e4e9_1732704225.jpg', 'https://pt123.cdn.static123.com/images/thumbs/900x600/fit/2024/11/27/z5550465012626-ff0f57b3124d5d31bca1a4e8a29da0cb_1732704232.jpg', 'https://pt123.cdn.static123.com/images/thumbs/900x600/fit/2024/11/27/z5537576799542-9ff87e2fc8bcdbceb73908946075844a_1732704232.jpg']",[],Huyền,0394246260,"['Cần SANG gấp CHDV đang cho thuê lợi nhuận full có thể 16tr/tháng', 'Bao gồm 4 phòng đầy đủ nội thất + 1 KTX (tối đa 12 giường)', 'Diện tích phòng từ 20m2-30m2, có toilet riêng, bếp và nội thất từng phòng, giá cho thuê từ 4tr-6tr/phòng.', 'Hệ thống an ninh camera', 'Giá sang 110 triệu', 'Giá thuê chủ nhà 18tr/tháng, hợp đồng thuê còn 5.5 năm.', 'Liên hệ chính chủ: 0394246260 để biết thông tin chi tiết.']",Căn hộ chung cư
CHO THUÊ - CĂN HỘ DỊCH VỤ - PHƯỜNG BẾN THÀNH - QUẬN 1,8.5 triệu/tháng,44 m2,"Lê Thị Riêng, Phường Bến Thành, Quận 1, Hồ Chí Minh",https://phongtro123.com/cho-thue-can-ho-dich-vu-phuong-ben-thanh-quan-1-pr669857.html,"['https://pt123.cdn.static123.com/images/thumbs/900x600/fit/2024/12/03/4f35176f074ebd10e45f2_1733235932.jpg', 'https://pt123.cdn.static123.com/images/thumbs/900x600/fit/2024/12/03/c0cc32dd22fc98a2c1ed1_1733235932.jpg', 'https://pt123.cdn.static123.com/images/thumbs/900x600/fit/2024/12/03/3ebcf1d0e1f15baf02e03_1733235934.jpg', 'https://pt123.cdn.static123.com/images/thumbs/900x600/fit/2024/12/03/68acafd0bff105af5ce04_1733235934.jpg', 'https://pt123.cdn.static123.com/images/thumbs/900x600/fit/2024/12/03/5506048cebad51f308bc5_1733235940.jpg', 'https://pt123.cdn.static123.com/images/thumbs/900x600/fit/2024/12/03/800f6c9183b039ee60a16_1733235954.jpg', 'https://pt123.cdn.static123.com/images/thumbs/900x600/fit/2024/12/03/fd6f4cc3a3e219bc40f37_1733235959.jpg']",[],Nguyễn Anh Tuấn,0932501428,"['CHO THUÊ - CĂN HỘ DỊCH VỤ - PHƯỜNG BẾN THÀNH - QUẬN 1', '..................', '️Nhà 121 Lê Thị Riêng, Phường Bến Thành, Quận 1, Tphcm', '* Giá: 8,5 triệu/tháng', '* 1pn 1 wc', '* Diện tích: 44m2', '* Giảm 2 tr cho 2 tháng đầu tiên', '* Giảm 1tr cho 2 tháng tiếp theo', '* Chỉ áp dụng hộp đồng thuê 12 tháng', '* Điện 4.000k/kw', '* Nước 100k/người', '* Phí quản lý 200k/phòng', '* free xe máy 2 chiếc', '* Hiện tại còn các phòng giá: 7,5 triệu, 8,5 triệu, 9,8 triệu .', '................', '* Hotline: 093 250 1428']",Căn hộ chung cư
CHO THUÊ - CĂN HỘ DỊCH VỤ - QUẬN 10 - TPHCM,5.8 triệu/tháng,20 m2,"493 Cách Mạng Tháng Tám, Phường 13, Quận 10, Hồ Chí Minh",https://phongtro123.com/cho-thue-can-ho-dich-vu-quan-10-tphcm-pr672198.html,"['https://pt123.cdn.static123.com/images/thumbs/900x600/fit/2024/12/16/2f459e10724bcf15965a2_1734354297.jpg', 'https://pt123.cdn.static123.com/images/thumbs/900x600/fit/2024/12/16/4bcb2184cddf708129ce4_1734354297.jpg', 'https://pt123.cdn.static123.com/images/thumbs/900x600/fit/2024/12/16/5bf0d7a33bf886a6dfe93_1734354299.jpg', 'https://pt123.cdn.static123.com/images/thumbs/900x600/fit/2024/12/16/94a2952a7971c42f9d601_1734354299.jpg', 'https://pt123.cdn.static123.com/images/thumbs/900x600/fit/2024/12/16/66480555e90e54500d1f5_1734354301.jpg', 'https://pt123.cdn.static123.com/images/thumbs/900x600/fit/2024/12/16/572f7ed993822edc77937_1734354301.jpg', 'https://pt123.cdn.static123.com/images/thumbs/900x600/fit/2024/12/16/c50290027c59c10798486_1734354303.jpg']",[],Nguyễn Anh Tuấn,0932501428,"['CHO THUÊ - CĂN HỘ DỊCH VỤ - QUẬN 10 - TPHCM', '* 493A/38 CMT8 - Quận 10 - Tphcm', '................', '* Giá : 5, 8 triệu/tháng', '* Điện 4k', '* Nước 100k', '* Phí dv 200k', '* Free xe', '* Thang máy', '* Nhà mới như hình', '* Ngày 1/1 trống', '....................', '* Hotline zalo: 093 250 1428']",Căn hộ chung cư
CHO THUÊ - CĂN HỘ VIVA - PLAZA - PHƯỜNG PHÚ MỸ - QUẬN 7,9 triệu/tháng,68 m2,"Nguyễn Lương Bằng, Phường Phú Mỹ, Quận 7, Hồ Chí Minh",https://phongtro123.com/cho-thue-can-ho-viva-plaza-phuong-phu-my-quan-7-pr670732.html,"['https://pt123.cdn.static123.com/images/thumbs/900x600/fit/2024/11/30/786e8926be55040b5d441_1732952547.jpg', 'https://pt123.cdn.static123.com/images/thumbs/900x600/fit/2024/11/30/82a37ee04993f3cdaa823_1732952554.jpg', 'https://pt123.cdn.static123.com/images/thumbs/900x600/fit/2024/11/30/602da168961b2c45750a2_1732952554.jpg', 'https://pt123.cdn.static123.com/images/thumbs/900x600/fit/2024/11/30/be000668311b8b45d20a6_1732952563.jpg', 'https://pt123.cdn.static123.com/images/thumbs/900x600/fit/2024/11/30/f9896cfc5b8fe1d1b89e4_1732952563.jpg', 'https://pt123.cdn.static123.com/images/thumbs/900x600/fit/2024/11/30/3857f439c34a7914205b5_1732952571.jpg', 'https://pt123.cdn.static123.com/images/thumbs/900x600/fit/2024/11/30/4c7d451d726ec830917f7_1732952575.jpg', 'https://pt123.cdn.static123.com/images/thumbs/900x600/fit/2024/11/30/4347cc59fb2a4174183b8_1732952581.jpg']",[],Nguyễn Anh Tuấn,0932501428,"['CHO THUÊ - CĂN HỘ VIVA - PLAZA', '* 15B Đường Nguyễn Lương Bằng, Phường Phú Mỹ, Quận 7, Tphcm', '................', '* Giá : 9 triệu/tháng', '* 2 pn 2 toilet', '* Diện tích : 68m2', '* Căn hộ thật mới', '* Tiện ích kề bên Chợ, Trường học các cấp ......', '* Hotline zalo: 093 250 1428']",Căn hộ chung cư
CHO THUÊ - CĂN HỘ CHUNG CƯ - AN GIA SKYLINE - QUẬN 7,16 triệu/tháng,84 m2,"86 Hoàng Quốc Việt, Phường Phú Thuận, Quận 7, Hồ Chí Minh",https://phongtro123.com/cho-thue-can-ho-chung-cu-an-gia-skyline-quan-7-pr672092.html,"['https://pt123.cdn.static123.com/images/thumbs/900x600/fit/2024/12/14/bb4b7aa3a8e615b84cf71_1734183041.jpg', 'https://pt123.cdn.static123.com/images/thumbs/900x600/fit/2024/12/14/e4578d2f5f6ae234bb7b3_1734183041.jpg', 'https://pt123.cdn.static123.com/images/thumbs/900x600/fit/2024/12/14/1a7d0041d2046f5a36156_1734183069.jpg', 'https://pt123.cdn.static123.com/images/thumbs/900x600/fit/2024/12/14/f89041de939b2ec5778a4_1734183087.jpg', 'https://pt123.cdn.static123.com/images/thumbs/900x600/fit/2024/12/14/7ecac4d61693abcdf2829_1734183087.jpg', 'https://pt123.cdn.static123.com/images/thumbs/900x600/fit/2024/12/14/ccfea1e773a2cefc97b38_1734183090.jpg', 'https://pt123.cdn.static123.com/images/thumbs/900x600/fit/2024/12/14/7ecac4d61693abcdf2829_1734183638.jpg', 'https://pt123.cdn.static123.com/images/thumbs/900x600/fit/2024/12/14/1a7d0041d2046f5a36156_1734183655.jpg', 'https://pt123.cdn.static123.com/images/thumbs/900x600/fit/2024/12/14/9212c9751b30a66eff212_1734183662.jpg', 'https://pt123.cdn.static123.com/images/thumbs/900x600/fit/2024/12/14/79052808fa4d47131e5c7_1734183661.jpg', 'https://pt123.cdn.static123.com/images/thumbs/900x600/fit/2024/12/14/ccfea1e773a2cefc97b38_1734183664.jpg', 'https://pt123.cdn.static123.com/images/thumbs/900x600/fit/2024/12/14/9bb3e26f312a8c74d53b10_1734183675.jpg', 'https://pt123.cdn.static123.com/images/thumbs/900x600/fit/2024/12/14/b9ed404793022e5c771311_1734183676.jpg']",[],Nguyễn Anh Tuấn,0932501428,"['CHO THUÊ - CĂN HỘ CHUNG CƯ - AN GIA SKYLINE - QUẬN 7', '* Hoàng Quốc Việt, Phường Phú Thuận, Quận 7, Tphcm', '..........................', '* Giá: 16 triệu/tháng', '* Diện tích: 84m2', '* 2 pn 2 toilet ( full nội thất cao cấp )', '* 1 phòng để đồ lớn, full nội thất sẵn sàng ở ngay. Tất cả phòng ngủ đều có cửa sổ. Ban công và phòng ngủ lớn có view sông thoáng mát. Tầng cao, mát mẻ.', '* Tiện ích: Nội, Ngoại khu đầy đủ không thiếu gì', '* Với những tiện ích giải trí đẳng cấp, xứng tầm hứa hẹn sẽ đem đến những giây phút thư giãn thoải mái cho cư dân tại đây .', '...................', '* Hotline zalo : 093 250 1428']",Căn hộ chung cư
CHO THUÊ - CĂN HỘ DỊCH VỤ - PHƯỜNG 2 - QUẬN TÂN BÌNH,10.5 triệu/tháng,45 m2,"54 Bạch Đằng, Phường 2, Quận Tân Bình, Hồ Chí Minh",https://phongtro123.com/cho-thue-can-ho-dich-vu-phuong-2-quan-tan-binh-2-pr669964.html,"['https://pt123.cdn.static123.com/images/thumbs/900x600/fit/2024/11/17/5bf883fe91c62a9873d71_1731848482.jpg', 'https://pt123.cdn.static123.com/images/thumbs/900x600/fit/2024/11/17/1f146bcf78f7c3a99ae67_1731848482.jpg', 'https://pt123.cdn.static123.com/images/thumbs/900x600/fit/2024/11/17/41cf37ec25d49e8ac7c52_1731848483.jpg', 'https://pt123.cdn.static123.com/images/thumbs/900x600/fit/2024/11/17/91e9850896302d6e74218_1731848483.jpg', 'https://pt123.cdn.static123.com/images/thumbs/900x600/fit/2024/11/17/240cccbedf8664d83d974_1731848484.jpg', 'https://pt123.cdn.static123.com/images/thumbs/900x600/fit/2024/11/17/753d74ba6782dcdc85933_1731848492.jpg', 'https://pt123.cdn.static123.com/images/thumbs/900x600/fit/2024/11/17/be7ccc70df4864163d5910_1731848492.jpg', 'https://pt123.cdn.static123.com/images/thumbs/900x600/fit/2024/11/17/c124e0f6f3ce489011df6_1731848493.jpg', 'https://pt123.cdn.static123.com/images/thumbs/900x600/fit/2024/11/17/db81402b5313e84db1025_1731848494.jpg', 'https://pt123.cdn.static123.com/images/thumbs/900x600/fit/2024/11/17/e896d693c5ab7ef527ba9_1731848497.jpg', 'https://pt123.cdn.static123.com/images/thumbs/900x600/fit/2024/11/17/ec4ff77be4435f1d065211_1731848498.jpg']",[],Nguyễn Anh Tuấn,0932501428,"['CHO THUÊ - CĂN HỘ - DỊCH VỤ - QUẬN TÂN BÌNH', '* 54 Đường Bạch Đằng, Phường 2, Quận Tân Bình, Tphcm', 'Giá : 10.500.000k / tháng', '---------------------', '* Giảm 2 triệu cho 2 tháng đầu tiên', '* Chỉ áp dụng hộp đồng 12 tháng', '* Điện 4.000k/kw', '* Nước 100k/người', '* Phí dịch vụ 200k/phòng', '* free xe máy', '* Thang máy', '* Cách Sân Bay khoảng 200m', '................', '* Hotline Zalo: 093 250 1428']",Căn hộ chung cư
CĂN HỘ MINI ban công gần chợ Nguyễn Sơn FULL NT,4 triệu/tháng,20 m2,"247 Hiền Vương, Phường Phú Thạnh, Quận Tân Phú, Hồ Chí Minh",https://phongtro123.com/can-ho-mini-ban-cong-gan-cho-nguyen-son-full-nt-pr670573.html,"['https://pt123.cdn.static123.com/images/thumbs/900x600/fit/2024/11/25/z4481760051342-fce955edade9ec5b26e6b9502277da6a_1732521827.jpg', 'https://pt123.cdn.static123.com/images/thumbs/900x600/fit/2024/11/25/z4481760041247-314cbe3edc9e9ef79ebffdbc96e1fbb5_1732521837.jpg', 'https://pt123.cdn.static123.com/images/thumbs/900x600/fit/2024/11/25/z4481760043709-b78be02feae1695dba2a84cfd52b7afd_1732521837.jpg', 'https://pt123.cdn.static123.com/images/thumbs/900x600/fit/2024/11/25/z4481760085167-875e1eea60b1d99279470d983c121235_1732521838.jpg', 'https://pt123.cdn.static123.com/images/thumbs/900x600/fit/2024/11/25/z4481760090650-bb73650034d1ce58696641d1af4ab3cc_1732521838.jpg']",[],Huỳnh Hữu Tình,0983098480,"['CHỦ NHÀ CHO THUÊ CĂN HỘ MINI BAN CÔNG - , FULL ĐẦY ĐỦ NỘI THẤT TIỆN NGHI.', '- Gần đường lớn: Nguyễn Sơn, Văn Cao, Tân Hương, Lũy Bán Bích....vô trung tâm chỉ vài phút.', '------- GIÁ ------ 4 TR', 'PHÍ DỊCH VỤ', 'Điện 3.500 đ/kwh', 'Nước1.00.000 đ/người', 'Xe 1.00.000 đ/xe', 'Wifi, rác100.000 đ/phòng', '+ GIỜ GIẤC ĐI VỀ TỰ DO', '+ CÓ MÁY GIẶT MIỄN PHÍ', 'DANH MỤC NỘI THẤT', '1. Kệ bếp, 2. Máy lạnh', '3. Máy giặt chung4. Giường, nệm', '5. Tủ quần áo6. Tủ lạnh', '7. Bàn làm việc', 'TIỆN ÍCH:', '+ Ban công view công viên siêu đẹp', '+ Wifi mạnh, Chổ phơi đồ rộng', '+ Nhà xe rộng rãi, sạch sẽ', '+ Cửa ra vào mở bằng vân tay, nhà xe có camera chống trộm 24/24', '+ Đường trước nhà rộng 8m, gần chợ, siêu thị, trung tâm.........', '--------> CÁC BẠN XEM PHÒNG XIN GỌI HẸN TRƯỚC', '- Địa chỉ: 247 Hiền Vương, Q.Tân Phú - ngay đường Nguyễn Sơn quẹo vô']",Căn hộ mini
"CHÍNH CHỦ CHO THUÊ CĂN HỘ CHUNG CƯ MINI 1N1K 40m2 FULL ĐỒ TẠI MỄ TRÌ, NAM TỪ LIÊM, HÀ NỘI",5.6 triệu/tháng,40 m2,"Đường Mễ Trì Thượng, Phường Mễ Trì, Quận Nam Từ Liêm, Hà Nội",https://phongtro123.com/cho-thue-can-ho-dep-cc-mini-1n1k-va-2n1k-ngo-89-duong-me-tri-thuong-me-tri-ha-noi-pr314893.html,"['https://pt123.cdn.static123.com/images/thumbs/900x600/fit/2021/08/17/img-1629111179134-1629167810772_1629171850.jpg', 'https://pt123.cdn.static123.com/images/thumbs/900x600/fit/2021/08/17/img-1629111179216-1629167810892_1629171872.jpg', 'https://pt123.cdn.static123.com/images/thumbs/900x600/fit/2021/08/17/img-1629111179100-1629167810727_1629171876.jpg', 'https://pt123.cdn.static123.com/images/thumbs/900x600/fit/2021/08/17/img-1629111179173-1629167810834_1629171888.jpg', 'https://pt123.cdn.static123.com/images/thumbs/900x600/fit/2021/08/17/img-1629111179065-1629167810681_1629171895.jpg', 'https://pt123.cdn.static123.com/images/thumbs/900x600/fit/2021/08/17/img-1629111178986-1629167810551_1629171906.jpg', 'https://pt123.cdn.static123.com/images/thumbs/900x600/fit/2021/08/17/img-1629111178949-1629167810439_1629171902.jpg']",[],Lực,0969139826,"['Chính chủ cho thuê căn hộ CCMN tại số 12, ngõ 89 Mễ Trì Thượng, Mễ Trì, Nam Từ Liêm, Hà Nội (ngay trường cấp 1 Mễ Trì, cuối ngõ 4 Đồng Me đi vào khoảng 30m) diện tích 40m2, 1 ngủ 1 khách, bếp ngăn riêng biệt với phòng ngủ không lo ám mùi.', '- Vị trí: Cách trường mầm non Mễ Trì Hạ 50m, cách trường cấp 1&2 Mễ trì 50m, cách chợ Mễ Trì Hạ 100m, cách đường Mễ Trì 150m, cách đường Lê Quang Đạo 200m, cách The Garden 200m, cách Keangnam Phạm Hùng 500m...', '- Tiện ích:', '+ Điều hòa', '+ Nóng lạnh', '+ Tủ lạnh', '+ Máy giặt', '+ Giường, táp, bàn phấn, rèm,', '+ Tủ quần áo', '+ Bàn ghế', '+ Tủ bếp, bếp từ, hút mùi', '+ Khu bếp ngăn tách riêng phòng ngủ', '+ Có ban công, cửa sổ thoáng mát', '+ Thang máy tốc độ cao', '+ Để xe miễn phí', '+ Giờ giấc thoải mái', '+ Khóa vân tay, camera từng tầng, wifi tốc độ cao...', '+ Ô tô 16 chỗ vào sát nhà', '+ Bãi gửi ôtô cách nhà 50m', '+ Có vệ sinh lau dọn hàng tuần sạch sẽ.', '- Diện tích 35m2 - Giá: 5.2tr/tháng (1N1K)', '- Diện tích 40m2 - Giá: 5.6tr/tháng (setup được 2N1K)', 'Cam kết Phòng như hình', '- LHCC: Lực 0969139826', '(Nhà mới, khách chỉ việc xách vali vào ở)']",Căn hộ mini
"Cực phẩm căn hộ studio ngay cầu Nguyễn Văn Cừ Q8, di chuyển giữa các Q4, Q5, Q1 200m là đến.",7.2 triệu/tháng,30 m2,"Dương Bá Trạc, Phường 1, Quận 8, Hồ Chí Minh",https://phongtro123.com/cuc-pham-can-ho-studio-ngay-cau-nguyen-van-cu-q8-di-chuyen-giua-cac-q4-q5-q1-200m-la-den-pr669618.html,"['https://pt123.cdn.static123.com/images/thumbs/900x600/fit/2024/11/13/z6005866640399-0e9a4cb68271930b68d2cb8c697b9d50_1731467818.jpg', 'https://pt123.cdn.static123.com/images/thumbs/900x600/fit/2024/11/13/z6005866643784-7d62b8a54b2cc10806d4ef3e43d732fd_1731467818.jpg', 'https://pt123.cdn.static123.com/images/thumbs/900x600/fit/2024/11/13/z6005866651969-4ef1bc89f0b9937e44e3a6d982763b25_1731467820.jpg', 'https://pt123.cdn.static123.com/images/thumbs/900x600/fit/2024/11/13/z6005866656807-91870e26c9910f8a6f186ab973e643fe_1731467820.jpg']",[],Nguyễn Thành Văn,0366856432,"['Sở hữu một căn phòng đẹp xinh lung linh. Mới xây 100%', 'Giờ giấc tự do, không chung chủ', 'Hầm xe rộng, thang máy', 'An ninh camera 24/7', 'Studio nội thất hiện đại mang lại cảm giác sang trọng.', 'Giá chỉ từ 7xxx', 'Liên hệ ngay để được hỗ trợ tư vấn nhiệt tình và xem phòng trực tiếp ạ.']",Căn hộ mini
