Title,Price,Room Size,Address,URL,Images,Videos,Author Name,Phone,Description,Category
"Giá rẻ nhất nhà mặt tiền 2 xe tải tránh nhau Thạnh Lộc 16, Q. 12, 60m2",5.5 triệu/tháng,60 m2,"75 Thạnh Lộc 16, Phường Thạnh Lộc, Quận 12, Hồ Chí Minh",https://phongtro123.com/gia-re-nhat-tu-truoc-den-nay-nha-mat-tien-tl16-q-12-60m2-5tr-thang-pr671089.html,"['https://pt123.cdn.static123.com/images/thumbs/900x600/fit/2024/12/03/201604144906-20151214112046-f7fb_1733192645.jpg', 'https://pt123.cdn.static123.com/images/thumbs/900x600/fit/2024/12/03/z6054852640431-62de29fcfd12142d97510095ec6e1f2a_1733192647.jpg', 'https://pt123.cdn.static123.com/images/thumbs/900x600/fit/2024/12/19/z6144352080982-47a15b04f6c97ad0a1d972112e9ec7b3_1734580307.jpg', 'https://pt123.cdn.static123.com/images/thumbs/900x600/fit/2024/12/19/z6144352085048-c4498295968d4408c2637e52130bb12b_1734580307.jpg', 'https://pt123.cdn.static123.com/images/thumbs/900x600/fit/2024/12/19/z6144352100681-00c5be816724759b615bc6b39e16a538_1734580308.jpg', 'https://pt123.cdn.static123.com/images/thumbs/900x600/fit/2024/12/19/z6144352107091-aa96945d2e9d4149a59b61d8deb83aed_1734580308.jpg', 'https://pt123.cdn.static123.com/images/thumbs/900x600/fit/2024/12/19/z6144352111720-5d863935303b746515891f1d37bca38d_1734580309.jpg', 'https://pt123.cdn.static123.com/images/thumbs/900x600/fit/2024/12/19/z6144352113835-20f30ab1bb20ab0b083d22140649c62a_1734580309.jpg', 'https://pt123.cdn.static123.com/images/thumbs/900x600/fit/2024/12/19/z6144352115072-1114f19a8e0191b926ea5b9f67f03de5_1734580310.jpg']",[],Uyen Luu,0939155454,"['Cần cho thuê nhà mặt tiền 2 xe tải tránh nhau đường Thạnh Lộc 16, 60 m², sân 5m, có 1 phòng ngủ, 1 WC, tiện ở và kinh doanh: Quán café, tiệm cắt tóc, tạp hóa,... Nhà gần chợ, chung cư First Home Thạnh Lộc, gần trường học, bệnh viện. Cách Ngã Tư Ga 1Km. Điện nước tính riêng theo giá nhà nước. Nhà mới sơn sửa như mới, dọn vào ở ngày.', 'Giá thuê: 5.5tr/tháng (Đặt cọc 1 tháng).', 'LH: 0939155454', 'Miễn MG']",Nhà nguyên căn
"Cho thuê nhà nguyên căn 1 trệt, 1 lầu, 02PN, P.16.Q.8",7.5 triệu/tháng,40 m2,"An Dương Vương, Phường 16, Quận 8, Hồ Chí Minh",https://phongtro123.com/cho-thue-nha-nguyen-can-1-tret-1-lau-02pn-p-16-q-8-pr671866.html,"['https://pt123.cdn.static123.com/images/thumbs/900x600/fit/2024/12/12/5_1733971014.jpg', 'https://pt123.cdn.static123.com/images/thumbs/900x600/fit/2024/12/12/2_1733971027.jpg', 'https://pt123.cdn.static123.com/images/thumbs/900x600/fit/2024/12/12/3_1733971039.jpg']",[],Nguyễn Hương Giang,0965106968,"['Chính chủ Cho thuê nhà 112/23 đường An Dương Vương, P 16, Q. 8.', 'Hẻm bê tông 5m, khu an ninh, yên tĩnh. có chỗ để xe oto, cách đường ADV 50m.', 'Dt 4*10m, 1 trệt 1 lầu, san thượng, 02 pn , 02 wc', 'nhà hướng nam gió mát cả ngày', 'Tiện ở gia đình, làm văn phòng công ty', 'Giá thuê 7,5tr/th', 'Vui lòng liên hệ: 0965106968']",Nhà nguyên căn
"Nhà NC cho thuê gần ngã tư Thủ Đức 1 trệt 2 lầu, mái bằng có tum. DT sàn 105m",8 triệu/tháng,105 m2,"129/11 Đường Trương Văn Hải, Phường Tăng Nhơn Phú B, Quận 9, Hồ Chí Minh",https://phongtro123.com/tinh-thanh/ho-chi-minh/nha-nc-cho-thue-gan-nga-tu-thu-duc-2-lau-dt-san-100m.html,"['https://pt123.cdn.static123.com/images/thumbs/900x600/fit/2020/01/08/lau-2-nha-129_1578440676.jpg', 'https://pt123.cdn.static123.com/images/thumbs/900x600/fit/2020/01/08/lau-1-nha-129_1578440694.jpg', 'https://pt123.cdn.static123.com/images/thumbs/900x600/fit/2024/12/11/tret-nha-129_1733923630.jpg', 'https://pt123.cdn.static123.com/images/thumbs/900x600/fit/2024/12/11/mt-nha-12911-truong-van-hai_1733923672.jpg']",[],phanthiha,0795833623,"['Chính chủ cho thuê nhà NC 1 trệt 2 lầu, và 1 tum trên mái bằng. DT sàn 105m, 4PN, 3 WC, hẻm xe tải thông giữa đường số 12 và Trương văn Hải. KDC hiện hữu, an ninh, không ngập nước. Ngã tư Thủ Đức rẽ bên hông Siêu thị Coopmart đường Quang Trung đến sau lưng trường THPT Hoa Lư ; Gần chợ Kiến Thiết, trường cấp 1,2.3, CĐ. ĐH. Nhà thờ, chùa, bến xe buýt, … số 129/11 Trương Văn Hải, P. TNP B, Q.9. Thích hợp làm VP giao dịch, gia đình ở. Giá 8 tr/tháng, cọc 1 tháng. Tiếp người thiện chí, MTB, MTG, cò, DVND, Q/cáo … nhà đất. LH chính chủ C. Hà 0795833623 trước khi đến xem nhà.']",Nhà nguyên căn
"Cho thuê nhà nguyên căn mới xây tại KCN Mỹ Phước 3, Bến Cát, Bình Dương, vừa ở, làm kho chứa hàng",12 triệu/tháng,300 m2,"Đường DI5, Xã Thới Hòa, Huyện Bến Cát, Bình Dương",https://phongtro123.com/chinh-chu-cho-thue-nha-kho-moi-xay-khu-cong-nghiep-mp3-ben-cat-binh-duong-pr671765.html,"['https://pt123.cdn.static123.com/images/thumbs/900x600/fit/2024/12/11/z6118919572318-01e292a1809c859012c08884c9d77c00_1733890888.jpg', 'https://pt123.cdn.static123.com/images/thumbs/900x600/fit/2024/12/11/z6118919572324-86d2c902aa0b352be89c1946ba9310db_1733890889.jpg', 'https://pt123.cdn.static123.com/images/thumbs/900x600/fit/2024/12/11/z6118919572308-1c198a9fcd9d757e7f26507f0fe0aabf_1733890887.jpg', 'https://pt123.cdn.static123.com/images/thumbs/900x600/fit/2024/12/11/z6118919572309-82b791802eb9ca3fdcbe4bbb02e483a4_1733890885.jpg', 'https://pt123.cdn.static123.com/images/thumbs/900x600/fit/2024/12/11/z6118919572313-9d6f6b5d5b5045aaf5e42adaf9db07e6_1733890885.jpg', 'https://pt123.cdn.static123.com/images/thumbs/900x600/fit/2024/12/11/z6118919572300-f267bf6c45799fb461634acff7917712_1733890886.jpg', 'https://pt123.cdn.static123.com/images/thumbs/900x600/fit/2024/12/11/z6118919572307-cdaf7a803b2933ae95566c0bce5d03d3_1733890886.jpg', 'https://pt123.cdn.static123.com/images/thumbs/900x600/fit/2024/12/11/z6118919572312-c8b8c80a04f8852eff452fa72082a961_1733890888.jpg', 'https://pt123.cdn.static123.com/images/thumbs/900x600/fit/2024/12/11/z6118919572315-af2e3bc3daa32814612ac28c8e05b7f4_1733890888.jpg']",[],Trần Thị Phương Nhung,0934110191,"['Cho thuê nhà nguyên căn mới xây tại địa chỉ Đường Di5, ô 38, KCN MỸ PHƯỚC 3 , Bến Cát , Bình Dương . Kết hợp vừa ở, làm kho chứa hàng, xưởng may mặc', 'Diện tích: 10x30=300m2.', 'Đường lớn xe công, xe tải ra vào thoải mái', 'Thích hợp may mặc, kho chứa hàng.', 'Giá cho thuê 12tr/th. Cọc 3 tháng.', 'Liên hệ :0918846776']",Nhà nguyên căn
"Cho thuê nhà Mặt tiền Đường Thạnh Mỹ Lợi, Phường Thạnh Mỹ Lợi, TP Thủ Đức",12 triệu/tháng,96 m2,"Thạnh Mỹ Lợi, Phường Thạnh Mỹ Lợi, Quận 2, Hồ Chí Minh",https://phongtro123.com/cho-thue-nha-mat-tien-duong-thanh-my-loi-phuong-thanh-my-loi-tp-thu-duc-pr672232.html,"['https://pt123.cdn.static123.com/images/thumbs/900x600/fit/2024/12/17/duong-tml-1_1734408909.jpg', 'https://pt123.cdn.static123.com/images/thumbs/900x600/fit/2024/12/17/duong-tml-2_1734408909.jpg', 'https://pt123.cdn.static123.com/images/thumbs/900x600/fit/2024/12/17/mat-tien_1734408910.jpg']",[],huacuong,0937189955,"['Cho thuê nhà Mặt tiền Đường Thạnh Mỹ Lợi, Phường Thạnh Mỹ Lợi, TP Thủ Đức (trước đây là Quận 2):', '- DTXD 48m2 (4x12), DTSD 96m2, 1 Trệt 1 Lầu. 1 Phòng khách, 3 Phòng ngủ, 1 Bếp, 2 WC.', '- Vị trí: Mặt tiền đường hiện hữu rộng 8m, nối Nguyễn Thị Định và Đồng Văn Cống, tiện kinh doanh/buôn bán. Khu dân cư, ngay gần UBND, bệnh viện, chợ, siêu thị, trường học, về Quận 1 chỉ 15 phút, cao tốc Long Thành 10 phút.', '- Giá thuê: 12tr/th', '- LH: chị Mi (ĐT: 0783450556)']",Nhà nguyên căn
Top nhà cho thuê vị trí đẹp 1 trệt 5 lầu mặt tiền 3/2 Quận 10 TP.HCM,30 triệu/tháng,160 m2,"3/2, Phường 9, Quận 10, Hồ Chí Minh",https://phongtro123.com/top-nha-cho-thue-vi-tri-dep-1-tret-5-lau-mat-tien-3-2-quan-10-tp-hcm-pr671722.html,"['https://pt123.cdn.static123.com/images/thumbs/900x600/fit/2024/12/10/1_1733825914.jpg', 'https://pt123.cdn.static123.com/images/thumbs/900x600/fit/2024/12/10/2_1733825914.png', 'https://pt123.cdn.static123.com/images/thumbs/900x600/fit/2024/12/10/4_1733825914.jpg']",[],Anh Sơn,0817409696,"['- Tọa lạc mặt tiền 3/2 gần ngã tư Nguyễn Tri Phương phường 9 trung tâm Q10 TP.HCM, khu văn phòng, buôn bán, kinh doanh đa ngành nghề.', '- Mất 5 phút cho mọi điểm đến: ăn uống - học hành - giải trí', '- Đầy đủ tiện ích ngoại khu, gần ngân hàng, trường học, công viên, trung tâm thương mại...', '- DT: 3 x 11m gồm 1 trệt 1 lửng 3 lầu sân thượng, 1 phòng khách 4 phòng ngủ 4 WC, mát mẻ, sinh khí, quý khách cư ngụ hoặc kinh doanh sẽ luôn may mắn và thành đạt.', '- Giá cho thuê 30 triệu/ tháng.', '- Hãy gọi ngay 0817.40.96.96 để được hỗ trợ uy tín, nhiệt tình, tận tâm.']",Nhà nguyên căn
"Cho thuê tập thể Kim Liên, Phố Phương Mai,3pn. cửa hàng, KDOL, 10tr/th",10 triệu/tháng,70 m2,"Đường Phương Mai, Kim Liên",https://phongtro123.com/cho-thue-tap-the-kim-lien-pho-phuong-mai-3pn-cua-hang-kdol-10tr-th-pr672278.html,['https://phongtro123.com/images/thumb_default.svg'],[],Sinh Nguyễn,0979836745,"['Cho thuê căn tập thể Kim Liên, Phố Phương Mai, Đống Đa, Hà Nội- Diện tích sử dụng: 70m2- Nhà gồm 3pn, 2vs, 1pk và bếp rộng.- Nhà phù hợp vừa ở, vừa làm cửa hàng, hoặc kinh doanh online, ngõ ô tô đỗ cửa, tiện giao thông- Giá thuê: 10tr/ tháng- Nhận nhà ngayLiên hệ trực tiếp, miễn trung gian']",Nhà nguyên căn
CHO THUÊ NHÀ NGUYÊN CĂN QUẬN 1 - CHỈ 11.5 TRIỆU/ THÁNG ĐẦY ĐỦ NỘI THẤT GẦN CHỢ BẾN THÀNH,11.5 triệu/tháng,70 m2,"212b/d75 Đường Nguyễn Trãi, Phường Nguyễn Cư Trinh, Quận 1, Hồ Chí Minh",https://phongtro123.com/cho-thue-nha-nguyen-can-quan-1-chi-11-5-trieu-thang-day-du-noi-that-gan-cho-ben-thanh-truong-dai-h-pr671272.html,"['https://pt123.cdn.static123.com/images/thumbs/900x600/fit/2024/12/04/img-1092_1733304647.jpg', 'https://pt123.cdn.static123.com/images/thumbs/900x600/fit/2024/12/04/img-1089_1733304649.jpg', 'https://pt123.cdn.static123.com/images/thumbs/900x600/fit/2024/12/04/img-1090_1733304657.jpg', 'https://pt123.cdn.static123.com/images/thumbs/900x600/fit/2024/12/04/img-1091_1733304658.jpg', 'https://pt123.cdn.static123.com/images/thumbs/900x600/fit/2024/12/04/img-1085_1733304662.jpg', 'https://pt123.cdn.static123.com/images/thumbs/900x600/fit/2024/12/04/img-1083_1733304663.jpg', 'https://pt123.cdn.static123.com/images/thumbs/900x600/fit/2024/12/04/img-1084_1733304665.jpg', 'https://pt123.cdn.static123.com/images/thumbs/900x600/fit/2024/12/04/img-1069_1733304667.jpg', 'https://pt123.cdn.static123.com/images/thumbs/900x600/fit/2024/12/04/img-0931_1733304672.jpg', 'https://pt123.cdn.static123.com/images/thumbs/900x600/fit/2024/12/04/img-0933_1733304673.jpg', 'https://pt123.cdn.static123.com/images/thumbs/900x600/fit/2024/12/04/beauty-1731139956627_1733304686.jpg', 'https://pt123.cdn.static123.com/images/thumbs/900x600/fit/2024/12/04/beauty-1731140266910_1733304706.jpg']",[],Lê Trang,0938663626,"['CHO THUÊ NHÀ NGUYÊN CĂN QUẬN 1 - CHỈ 11.5 TRIỆU/ THÁNG ĐẦY ĐỦ NỘI THẤT GẦN CHỢ BẾN THÀNH.TRƯỜNG ĐẠI HỌC', 'Bạn cần một căn nhà tiện nghi ở trung tâm Sài Gòn? Căn nhà 1 trệt 2 lầu này sẽ là lựa chọn lý tưởng với:', 'Tiện ích hoàn hảo', 'Nhà rộng 75m2, 2 phòng ngủ lớn (có thể chia 4), ban công thoáng mát.', 'Nội thất đầy đủ: máy lạnh, tủ lạnh, máy giặt, giường nệm, bếp nấu,… chỉ cần dọn vào ở ngay.', 'Vị trí trung tâm: gần chợ, siêu thị, công viên, bệnh viện, phố Bùi Viện, thuận tiện di chuyển.', 'Khu vực an ninh, yên tĩnh, lý tưởng để sinh sống.', 'Ưu đãi có hạn - Gọi ngay để xem nhà!', 'Liên hệ chị Trang zalo 0938663626,', 'giá thuê 11.5 triệu/tháng. Đừng bỏ lỡ cơ hội sống ở trung tâm với mức giá tốt!']",Nhà nguyên căn
Cho thuê Nhà tại KDC Cát Lái Q2 đường 12m xe tải xe hơi xe cont đậu được,14 triệu/tháng,100 m2,"35CL, Phường Cát Lái, Quận 2, Hồ Chí Minh",https://phongtro123.com/cho-thue-nha-tai-kdc-cat-lai-q2-duong-12m-xe-tai-xe-hoi-xe-cont-dau-duoc-pr672294.html,"['https://pt123.cdn.static123.com/images/thumbs/900x600/fit/2024/12/18/z6028125887556-87743ac2258ca91c9dcf7ecc6fa99b66_1734511257.jpg', 'https://pt123.cdn.static123.com/images/thumbs/900x600/fit/2024/12/18/z6028125904403-0496874a267bf42ce1f8de73a43ef067_1734511257.jpg', 'https://pt123.cdn.static123.com/images/thumbs/900x600/fit/2024/12/18/z6028125904404-b3a5528458e333936ab31a0a0813bd18_1734511258.jpg', 'https://pt123.cdn.static123.com/images/thumbs/900x600/fit/2024/12/18/z6028125904405-297a1ca3d067225ee57b0c3b95bf052a_1734511258.jpg', 'https://pt123.cdn.static123.com/images/thumbs/900x600/fit/2024/12/18/z6028125904406-01ba7ca46e4f83454d51a5d60c8d3f7e_1734511259.jpg', 'https://pt123.cdn.static123.com/images/thumbs/900x600/fit/2024/12/18/z6028125904419-11375609ba5126e88516fdf2d2e61804_1734511259.jpg', 'https://pt123.cdn.static123.com/images/thumbs/900x600/fit/2024/12/18/z6028125904427-90b91d651c4fa34eb5b72d0a2ce83d88_1734511260.jpg', 'https://pt123.cdn.static123.com/images/thumbs/900x600/fit/2024/12/18/z6028125904429-d873e4445b63ba8db9a84d65259564d9_1734511260.jpg']",[],KimPhat House,0908789264,"['Cho thuê Nhà tại KDC Cát Lái Q2 đường 12m', 'Citi Bella 1, DT 5.2x16m, 1 Trệt 2 Lầu', 'Nhà hoàn thiện full nội thất', '4 PN, 4 WC', 'Giá 14tr (đã gồm phí quản lý)', 'LH xem nhà: 0908 789 264']",Nhà nguyên căn
NHÀ NGUYÊN CĂN - 1 Trệt 1 Gác suốt cho thuê ở Bình Chánh,5 triệu/tháng,60 m2,"C3/30 Phạm Hùng, Xã Bình Hưng, Huyện Bình Chánh, Hồ Chí Minh",https://phongtro123.com/nha-nguyen-can-1-tret-1-gac-suot-pr667857.html,"['https://pt123.cdn.static123.com/images/thumbs/900x600/fit/2024/10/22/1iapjn6cr-3p2en4_1729585724.jpg', 'https://pt123.cdn.static123.com/images/thumbs/900x600/fit/2024/10/22/1iapjn6g4-3p2en4_1729585725.jpg', 'https://pt123.cdn.static123.com/images/thumbs/900x600/fit/2024/10/22/1iapjn6hs-3p2en4_1729585725.jpg', 'https://pt123.cdn.static123.com/images/thumbs/900x600/fit/2024/10/22/1iapjn6kb-3p2en4_1729585726.jpg', 'https://pt123.cdn.static123.com/images/thumbs/900x600/fit/2024/12/18/img-0009_1734485085.jpg', 'https://pt123.cdn.static123.com/images/thumbs/900x600/fit/2024/10/22/1iapjn6il-3p2en4_1729585725.jpg', 'https://pt123.cdn.static123.com/images/thumbs/900x600/fit/2024/12/18/img-0012_1734485085.jpg', 'https://pt123.cdn.static123.com/images/thumbs/900x600/fit/2024/10/22/1iapjn6jf-3p2en4_1729585726.jpg', 'https://pt123.cdn.static123.com/images/thumbs/900x600/fit/2024/12/18/img-0011_1734485086.jpg', 'https://pt123.cdn.static123.com/images/thumbs/900x600/fit/2024/12/18/img-0010_1734485086.jpg']",[],Phungtran,0937938205,"['S sử dụng =30x2=60m2', '(1 kho để xe, 1 phòng khách, 1phòng bếp, 1nhà VS, 1 gác suốt...vách ngăn phòng + gác đều là chất liệu bê tông)', 'Điện theo giá nhà nước', 'Nước máy 20k / mét khối', 'Giờ giấc tự do', 'Rác giá nhà nước', 'Cọc 1 tháng/ 5tr', 'Tiện nghi: Đối diện Siêu thị Satra & nhà sách Nguyễn Văn Cừ', 'Liên hệ: Cô Tuyết 0398973186 _Chú Vì 0919127490', 'C.Thuyền 0909439940']",Nhà nguyên căn
"QUÁ HOT ! NHÀ NGUYÊN CĂN, 3 PHÒNG NGỦ NGAY TRẦN BÁ GIAO, GIÁ CHỈ 10 TRIỆU",10 triệu/tháng,50 m2,"Trần Bá Giao, Phường 5, Quận Gò Vấp, Hồ Chí Minh",https://phongtro123.com/qua-hot-nha-nguyen-can-3-phong-ngu-ngay-tran-ba-giao-gia-chi-10-trieu-pr672249.html,"['https://pt123.cdn.static123.com/images/thumbs/900x600/fit/2024/12/17/1000011882_1734422613.jpg', 'https://pt123.cdn.static123.com/images/thumbs/900x600/fit/2024/12/17/1000011881_1734422613.jpg', 'https://pt123.cdn.static123.com/images/thumbs/900x600/fit/2024/12/17/1000011883_1734422693.jpg', 'https://pt123.cdn.static123.com/images/thumbs/900x600/fit/2024/12/17/1000011880_1734422693.jpg']",[],Khoi,0702412600,"['GẤP LẮM ! CÒN DUY NHẤT VÀI PHÒNG VIP NHẤT GÒ VẤP, NGAY NGUYỄN KIỆM FULL NỘI THẤT + CÓ BANCOL', 'Vị Trí: NGAY TRẦN BÁ GIAO', 'Diện tích: 40M2', 'Nội Thất Mới', 'Nhà hẻm 1/, gần măt tiền', 'Không gian thoải mái, cửa sổ to và nội thất hiện đại', 'Tiện ích: không chung chủ, giờ giấc tự do, cho nuôi pet', 'Liên hệ: gọi ngay 0938525803 ( Nam ).']",Nhà nguyên căn
"Nhà cho thuê nguyên căn. Dt 3*10m, gác suốt",3.5 triệu/tháng,30 m2,"Đường số 35, Phường Long Bình, Quận 9, Hồ Chí Minh",https://phongtro123.com/nha-cho-thue-nguyen-can-dt-4m-10m-gac-suot-pr614671.html,"['https://pt123.cdn.static123.com/images/thumbs/900x600/fit/2023/01/26/8b753561-2858-4703-94c0-185f7da3caee_1674724610.jpg', 'https://pt123.cdn.static123.com/images/thumbs/900x600/fit/2023/01/26/d4967199-31e6-45af-991b-011374ac3fa5_1674724602.jpg', 'https://pt123.cdn.static123.com/images/thumbs/900x600/fit/2023/01/26/5d0c563d-5ff6-4644-bcd9-227ce084ffa5_1674724603.jpg', 'https://pt123.cdn.static123.com/images/thumbs/900x600/fit/2023/01/26/8c0fcf1e-8c35-479a-829c-e40ca0c629b8_1674724609.jpg', 'https://pt123.cdn.static123.com/images/thumbs/900x600/fit/2023/01/26/a2e4111b-b069-42dc-b112-e2491ef77c13_1674724612.jpg']",[],Phạm Tấn Hoàng,0393653189,"['Nhà mới xây, sạch đẹp, thoáng mát, khu Phước Thiện , gần vinhome', 'đường truoc nhà 8m, nhà cấp 3 (1trệt + gác suốt)', 'tong Dtsd 60m2, bao gồm sân để xe, phòng khách, bếp, 1WC, bồn rữa....', 'Khu an ninh, cao ráo không gập nước', 'cuối th.11 nhận nhà, sáng 8h-12h, chiều 14h-21h', 'gọi k được hãy nhắn tin, sẽ có hồi đáp sớm nhất, xin cảm ơn!']",Nhà nguyên căn
Cho Thuê nhà Lý Chiêu Hoàng Phường 10 Quận 6,3.5 triệu/tháng,30 m2,"43/4A5 Đường Lý Chiêu Hoàng, Phường 10, Quận 6, Hồ Chí Minh",https://phongtro123.com/cho-thue-nha-ly-chieu-hoang-phuong-10-quan-6-pr604808.html,['https://pt123.cdn.static123.com/images/thumbs/900x600/fit/2022/07/24/3311_1658646846.jpg'],[],Dang Lệ Hương,0792079596,"['Cho thuê nhà nguyên căn', 'Nhà nằm trong hẽm', 'Tuy nhà cũ nhưng khá thoáng và thoải mái', 'Giá thuê: 3tr5/tháng', 'Thông tin liên hệ: 0792079596 Hương']",Nhà nguyên căn
Cho thuê nhà 50m2 - Phú Hòa - Thủ Dầu Một - Bình Dương,3.5 triệu/tháng,50 m2,"179/58 Đường Nguyễn Thái Bình, Phường Phú Hòa, Thành phố Thủ Dầu Một, Bình Dương",https://phongtro123.com/cho-thue-nha-50m2-phu-hoa-thu-dau-mot-binh-duong-pr672164.html,"['https://pt123.cdn.static123.com/images/thumbs/900x600/fit/2024/12/16/whatsapp-image-2024-12-16-at-081851_1734320691.jpg', 'https://pt123.cdn.static123.com/images/thumbs/900x600/fit/2024/12/16/whatsapp-image-2024-12-16-at-081852-1_1734320691.jpg', 'https://pt123.cdn.static123.com/images/thumbs/900x600/fit/2024/12/16/whatsapp-image-2024-12-16-at-081852_1734320691.jpg', 'https://pt123.cdn.static123.com/images/thumbs/900x600/fit/2024/12/16/whatsapp-image-2024-12-16-at-081853_1734320691.jpg', 'https://pt123.cdn.static123.com/images/thumbs/900x600/fit/2024/12/16/whatsapp-image-2024-12-16-at-081854_1734320692.jpg']",[],Hoàng Ngọc Dũng,0357481814,"['Cho thuê nhà 50m2 - Phú Hòa- Thủ Dầu Một-Bình Dương', '- Vị trí đường Nguyễn Thái Bình ,gần trường THCS Phú Hòa 2', '- Diện tích 50m2- có 1 gác lửng', '- Gần trường, chợ, khu dân cư đông đúc.', '- Hẻm xe hơi, có sân rộng để xe hơi thoải mái']",Nhà nguyên căn
"Nhà cấp 4, 30m2, nội thất cơ bản, sân rộng, Khương Trung",3.6 triệu/tháng,30 m2,"Ngõ 211 Khương Trung, Phường Khương Trung, Quận Thanh Xuân, Hà Nội",https://phongtro123.com/nha-cap-4-30m2-noi-that-co-ban-san-rong-khuong-trung-2-pr672143.html,"['https://pt123.cdn.static123.com/images/thumbs/900x600/fit/2024/12/16/20210306-103906_1734282012.jpg', 'https://pt123.cdn.static123.com/images/thumbs/900x600/fit/2024/12/16/img-20200229-120411_1734282045.jpg']",[],Linh Phan,0984805897,"['Gia đình chúng tôi có 2 căn nhà liền kề muốn cho thuê.', 'Một căn 28m2, 1 căn 33m2 có gác xép.', 'Nhà được xây kiên cố, bão Yagi không ngập 1cm hay nhỏ 1 giọt nước nào qua mái.', 'Được trang bị nội thất cơ bản gồm: bàn, tủ, điều hòa, nóng lạnh, mạng internet...', 'Nhà có sân rộng để phơi đồ, để xe và chỗ chơi cho trẻ em thoải mái.', 'Ở cùng gia chủ nên yên tâm về trách nhiệm, an ninh...', 'Chúng tôi tìm gia đình gắn bó lâu dài và ổn định.', 'Giá thuê từng căn vui lòng liên hệ trực tiếp.', 'Liên hệ Cô Phúc chủ nhà']",Nhà nguyên căn
Cho thuê nhà nguyên căn Pháo Đài Láng – Chính chủ,8 triệu/tháng,126 m2,"7 Phố Pháo Đài Láng, Phường Láng Thượng, Quận Đống Đa, Hà Nội",https://phongtro123.com/cho-thue-nha-nguyen-can-phao-dai-lang-chinh-chu-pr672141.html,"['https://pt123.cdn.static123.com/images/thumbs/900x600/fit/2024/12/15/3_1734278918.jpg', 'https://pt123.cdn.static123.com/images/thumbs/900x600/fit/2024/12/15/4_1734278916.jpg', 'https://pt123.cdn.static123.com/images/thumbs/900x600/fit/2024/12/15/1_1734278934.jpg', 'https://pt123.cdn.static123.com/images/thumbs/900x600/fit/2024/12/15/2_1734278938.jpg']",[],Bình,0826177459,"['- Địa chỉ: phố Pháo Đài Láng (cách Nguyễn Chí Thanh 800m), giao thông thuận tiện, gần trường học, bệnh viện, chợ Pháo Đài Láng trước cửa, siêu thị, các trung tâm hành chính…', '- Nhà 3 tầng, 43mx3 tầng (3 ngủ, 1 bếp, 1 ban công)', '- Thích hợp cho hộ gia đình thuê.', '- Giá cả liên hệ inbox hoặc 0826177459']",Nhà nguyên căn
"Cho thuê nhà nguyên căn trống 1 trệt 1 lầu, 2 PN 2 WC Âu Dương Lân",7 triệu/tháng,22 m2,"125/49A Đường số 9, Phường 1, Quận 8, Hồ Chí Minh",https://phongtro123.com/cho-thue-nha-nguyen-can-trong-1-tret-1-lau-2-pn-2-wc-au-duong-lan-pr672138.html,"['https://pt123.cdn.static123.com/images/thumbs/900x600/fit/2024/12/15/1_1734276443.jpg', 'https://pt123.cdn.static123.com/images/thumbs/900x600/fit/2024/12/15/2_1734276443.jpg', 'https://pt123.cdn.static123.com/images/thumbs/900x600/fit/2024/12/15/3_1734276444.jpg', 'https://pt123.cdn.static123.com/images/thumbs/900x600/fit/2024/12/15/4_1734276445.jpg', 'https://pt123.cdn.static123.com/images/thumbs/900x600/fit/2024/12/15/5_1734276445.jpg', 'https://pt123.cdn.static123.com/images/thumbs/900x600/fit/2024/12/15/6_1734276447.jpg', 'https://pt123.cdn.static123.com/images/thumbs/900x600/fit/2024/12/15/7_1734276447.jpg', 'https://pt123.cdn.static123.com/images/thumbs/900x600/fit/2024/12/15/8_1734276448.jpg', 'https://pt123.cdn.static123.com/images/thumbs/900x600/fit/2024/12/15/9_1734276448.jpg', 'https://pt123.cdn.static123.com/images/thumbs/900x600/fit/2024/12/15/11_1734276448.jpg']",[],Vương,0775027197,"['Cho thuê nhà P1 Q8 ngang 3 dài 7, 2 phòng ngủ, 2 wc, 1 bếp. Đường lớn cách cầu Nguyễn Văn Cừ 5 phút', 'Giá 7tr, điện nước chính thức', 'Mình là chủ: 0775027197']",Nhà nguyên căn
